{
  "schema_version": "covenant.autonomous-repair-governance-request.v1",
  "request_id": "repair-run-20260728",
  "mode": "write",
  "repository": "fixture/external-repair",
  "ownership_class_assertion": "external",
  "issue_number": 101,
  "action": "open_upstream_draft_pr",
  "current_base_sha": "1111111111111111111111111111111111111111",
  "changed_path_classes": [
    "source"
  ],
  "approved_action_digest": "9927b790a49485d0c8069204c3bd2fd9b1115f69c4e04d72ff234e3e20e9afca",
  "run_envelope": {
    "schema": "ao.architecture.autonomous-issue-repair.run-envelope.v1",
    "run_id": "repair-run-20260728",
    "loop": {
      "goal": "Repair one controlled fixture.",
      "trigger": "Use an exact repository policy.",
      "discovery": "Use bounded discovery.",
      "action": "Perform one bounded action.",
      "verification": "Require deterministic checks.",
      "state": "Persist canonical evidence.",
      "human_gates": "Apply repository governance."
    },
    "trigger": {
      "mode": "explicit_issue",
      "canonical_url": "https://github.com/fixture/external-repair/issues/101",
      "repository": "fixture/external-repair",
      "default_branch": "main",
      "pinned_base_commit": "1111111111111111111111111111111111111111"
    },
    "discovery": {
      "snapshot_limit": 50,
      "candidate_limit": 10,
      "selected_limit": 1
    },
    "budgets": {
      "wall_clock_seconds": 28800,
      "clone_count": 1,
      "test_runs": 20,
      "retry_count": 3,
      "repair_count": 1,
      "publication_count": 1
    },
    "governance": {
      "ownership_class": "external",
      "allowed_actions": [
        "push_operator_fork",
        "open_upstream_draft_pr"
      ],
      "denied_actions": [
        "push_upstream",
        "open_ready_pr",
        "mark_ready",
        "approve_review",
        "merge",
        "mutate_issue",
        "publish_release"
      ],
      "sole_control_auto_merge_opt_in": false
    },
    "routing": {
      "default_branch": "main",
      "pinned_base_commit": "1111111111111111111111111111111111111111",
      "fork_owner": "operator",
      "repair_branch": "codex/repair-issue",
      "protected_path_classes": [
        "dependency",
        "workflow",
        "credential",
        "permission",
        "policy",
        "schema",
        "migration",
        "release",
        "security_boundary",
        "generated_artifact"
      ],
      "required_checks": [
        "test",
        "lint"
      ]
    },
    "created_at": "2026-07-27T16:00:00Z",
    "expires_at": "2026-07-28T00:00:00Z",
    "canonical_digest": "506d2310cf94d6142ccbab5c1d728292f31de58e3d9827f65a7c9925e504312a",
    "predecessor_digest": null,
    "lineage": {
      "kind": "origin",
      "predecessor_run_id": null,
      "predecessor_digest": null
    },
    "stop_conditions": [
      "policy_ambiguity",
      "security_sensitive",
      "digest_mismatch",
      "required_check_conflict"
    ],
    "terminal_statuses": [
      "completed",
      "blocked",
      "expired"
    ]
  },
  "candidate_decision": {
    "schema": "ao.architecture.autonomous-issue-repair.candidate-decision.v1",
    "run_id": "repair-run-20260728",
    "repository": "fixture/external-repair",
    "base_sha": "1111111111111111111111111111111111111111",
    "issue_number": 101,
    "rank": 1,
    "decision": "selected",
    "eligibility": {
      "open_bug": true,
      "target_in_repository": true,
      "no_existing_fix": true,
      "current_head_unfixed": true,
      "security_sensitive": false,
      "public_reproduction_feasible": true,
      "deterministic_local_reproduction": true,
      "expected_behavior_grounded": true,
      "bounded_policy_compatible": true
    },
    "reason_codes": [
      "eligible_all_predicates_passed"
    ],
    "evidence_digests": [
      "6666666666666666666666666666666666666666666666666666666666666666"
    ],
    "expected_behavior_source": "tests",
    "decided_at": "2026-07-27T22:00:00Z",
    "decision_digest": "cf7adb8ce2d032b100577daba99a1e2431d19813e2cc888e37f1cd5c0c805fbc"
  },
  "governance_decision": {
    "schema": "ao.architecture.autonomous-issue-repair.governance-decision.v1",
    "run_id": "repair-run-20260728",
    "repository": "fixture/external-repair",
    "base_sha": "1111111111111111111111111111111111111111",
    "head_sha": "bbbbbbbbbbbbbbbbbbbbbbbbbbbbbbbbbbbbbbbb",
    "governance_class": "external",
    "classification_sources": [
      "repository_policy",
      "operator_envelope"
    ],
    "push_target": "operator_owned_fork",
    "pull_request_mode": "upstream_draft_only",
    "merge": {
      "authorized": false,
      "mode": "never",
      "approval_kind": "none",
      "approval_head_sha": null,
      "auto_merge_opt_in": false,
      "branch_protection_bypassed": false
    },
    "protected_path_touched": false,
    "required_checks": [
      {
        "name": "test",
        "conclusion": "success",
        "head_sha": "bbbbbbbbbbbbbbbbbbbbbbbbbbbbbbbbbbbbbbbb"
      },
      {
        "name": "lint",
        "conclusion": "success",
        "head_sha": "bbbbbbbbbbbbbbbbbbbbbbbbbbbbbbbbbbbbbbbb"
      }
    ],
    "action_digest_required": true,
    "decided_at": "2026-07-27T23:10:00Z",
    "decision_digest": "a7df39fb5d1c48d08b1eaf36e894df8e576c4708742663760b0c57066617b86f"
  },
  "reviewer_independence": {
    "schema": "ao.architecture.autonomous-issue-repair.reviewer-independence.v1",
    "run_id": "repair-run-20260728",
    "subject_digest": "ffffffffffffffffffffffffffffffffffffffffffffffffffffffffffffffff",
    "reviewer_id": "independent-reviewer",
    "status": "independent",
    "deterministic_tests_primary": true,
    "satisfies_team_merge_gate": false,
    "reviewed_at": "2026-07-27T23:15:00Z",
    "review_digest": "9ff295917b4d875f9b9daaa7f7d343857e13be950db0552c9a9d243d094b1c87"
  },
  "github_action_digest": {
    "schema": "ao.architecture.autonomous-issue-repair.github-action-digest.v1",
    "run_id": "repair-run-20260728",
    "repository": "fixture/external-repair",
    "issue_number": 101,
    "base_sha": "1111111111111111111111111111111111111111",
    "head_sha": "bbbbbbbbbbbbbbbbbbbbbbbbbbbbbbbbbbbbbbbb",
    "fork": "operator/external-repair",
    "branch": "codex/repair-issue",
    "pr_title_digest": "dddddddddddddddddddddddddddddddddddddddddddddddddddddddddddddddd",
    "pr_body_digest": "eeeeeeeeeeeeeeeeeeeeeeeeeeeeeeeeeeeeeeeeeeeeeeeeeeeeeeeeeeeeeeee",
    "diff_digest": "ffffffffffffffffffffffffffffffffffffffffffffffffffffffffffffffff",
    "required_checks": [
      {
        "name": "test",
        "conclusion": "success",
        "head_sha": "bbbbbbbbbbbbbbbbbbbbbbbbbbbbbbbbbbbbbbbb"
      },
      {
        "name": "lint",
        "conclusion": "success",
        "head_sha": "bbbbbbbbbbbbbbbbbbbbbbbbbbbbbbbbbbbbbbbb"
      }
    ],
    "action": "open_upstream_draft_pr",
    "approved_at": "2026-07-27T23:20:00Z",
    "expires_at": "2026-07-28T00:00:00Z",
    "run_envelope_digest": "506d2310cf94d6142ccbab5c1d728292f31de58e3d9827f65a7c9925e504312a",
    "candidate_decision_digest": "cf7adb8ce2d032b100577daba99a1e2431d19813e2cc888e37f1cd5c0c805fbc",
    "governance_decision_digest": "a7df39fb5d1c48d08b1eaf36e894df8e576c4708742663760b0c57066617b86f",
    "reviewer_independence_digest": "9ff295917b4d875f9b9daaa7f7d343857e13be950db0552c9a9d243d094b1c87",
    "action_digest": "9927b790a49485d0c8069204c3bd2fd9b1115f69c4e04d72ff234e3e20e9afca"
  }
}
